section,headline,article_url,article,abstract,article_id,image,caption,image_id,image_path,section_numeric
Books,"Mercedes Barcha, Gabriel García Márquez's Wife and Muse, Dies at 87",https://www.nytimes.com/2020/08/23/books/mercedes-barcha-dead.html,"Mercedes Barcha and her husband, the Colombian novelist Gabriel Garcia Marquez, in 2007. ""Mercedes permeates all my books,"" Garcia Marquez once said. ""There's traces of her everywhere.""





Mercedes Barcha, the widow, muse and gatekeeper of the Nobel laureate Gabriel Garcia Marquez, who played a crucial role in the publication of his breakthrough novel, ""One Hundred Years of Solitude,"" died on Aug. 15 at her home in Mexico City. She was 87. Her death was confirmed by her son Rodrigo Garcia, who said she had suffered from respiratory problems for many years. Mercedes and Gabo, as the couple were known, were living in Mexico City in 1965 when Garcia Marquez began work on ""One Hundred Years of Solitude,"" the hypnotic, time-bending tale of the mythical village of Macondo, based on the area of Colombia where they had both grown up. For more than a decade, Garcia Marquez had been eking out a living as a journalist -- a passionate leftist, he spent a year in the New York office of Prensa Latina, the Cuban press agency -- while banging out short stories and novellas. For 18 months, he had holed up in his office in their home while Ms. Barcha kept the landlord, and the world, at bay. When he emerged in late 1966, he later recalled, she asked: ""Did you really finish it? We owe $12,000.""

She then pawned her hair dryer and the couple's blender so she could pay the postage to send the manuscript to his Argentine editor. The book -- a South American Genesis, as many would call it, or ""an intricate stew of truths and mirages,"" as Garcia Marquez wrote, in which priests levitated and flowers rained from the sky -- would go on to sell nearly 50 million copies. ""One Hundred Years of Solitude"" and many of the other novels and collections Garcia Marquez published in the decades to follow would be among the rare literary works to enjoy both popular and critical success. Its themes and characters swirled throughout all his books: savage political violence, passions romantic and otherwise, ghosts, family secrets, idealistic questing madmen and, always, the practical yet mystical women who grounded them -- female avatars inspired in one way or another by Ms. Barcha, a sharp-witted beauty he had fallen for when they were children.

""Mercedes permeates all my books,"" he once said. ""There's traces of her everywhere."" ""He called her the manager of the crisis department,"" their son Rodrigo Garcia said, ""sometimes without him even knowing what the crisis was."" Mercedes Barcha Pardo was born on Nov. 6, 1932, in Magangue, Colombia. Her father, Demetrio Barcha, was a pharmacist; her mother, Rachel Pardo, was a homemaker. The oldest of seven children, Mercedes grew up in Sucre and then Barranquilla, on the Caribbean coast of Colombia, where her family moved to avoid the political violence that convulsed the region at midcentury. There, home on holiday from convent school, she re-met Garcia Marquez, who was writing for a local newspaper. As the story goes, he had already proposed marriage the moment he saw her back in Sucre, when she was 9 and he was 14. From the start he found her beautiful and enigmatic, ""with an illusionist's talent for evading questions,"" as he wrote in his 2003 memoir, ""Living to Tell the Tale."" When Garcia Marquez was sent to Europe as a foreign correspondent, he wrote to Ms. Barcha regularly. After his newspaper was shut down, he found himself broke in Paris, living in a hotel room and working on a manuscript. Her photo on the wall and a red Olivetti typewriter were among his only belongings. Upon his return to South America in 1957, he paid Ms. Barcha 500 pesos (the equivalent of about $130, or about $1,200 today) to return his letters -- she wouldn't give them up without a prize -- and promptly destroyed them. ""He was years away from being famous,"" Rodrigo Garcia said, ""but he was always very particular about their lives being private. He didn't want the paper trail."" The two married in 1958. On the day of the wedding, Ms. Barcha waited to put on her wedding dress until he had driven up. ""It's not that she doubted him,"" Mr. Garcia said, ""but she had the superstition and the pragmatism of people from a certain world that said, 'There's a one-in-a-million chance that a bridegroom might not appear for his wedding.' So it was just in case.""

Their friend Jorge Eduardo Ritter, who had been Panama's ambassador to Colombia, described Ms. Barcha as akin to a president's adviser. ""She let him know what he needed to know,"" he said. ""She was more informed than he was, having read all the newspapers while he worked each morning."" If she had neglected to give him money for lunch, Mr. Ritter continued, ""He would say, 'Mercedes didn't give me cash, so you will have to pay.'"" When his novel ""Love in the Time of Cholera"" was published in English in 1988, Garcia Marquez told Pete Hamill, who wrote about him for Vanity Fair: ""You write better with all your problems resolved. You write better in good health. You write better without preoccupations. You write better when you have love in your life. There is a romantic idea that suffering and adversity are very good, very useful for the writer. I don't agree at all."" The couple had homes in Mexico City and Cuernavaca, Mexico; in Barcelona and Paris; in Cartagena and Barranquilla, Colombia; and, rather problematically, in Havana, a so-called protocol house lent them by Fidel Castro, to whom Garcia Marquez remained a loyal friend, confounding almost everyone. Because of their friendship, the United States government denied Garcia Marquez an unrestricted visa until President Bill Clinton, a fan, invited him to Martha's Vineyard in 1995 (although before then he had been issued waivers to receive a visa whenever he wanted to visit the United States). Even in that friendship, apparently, Ms. Barcha had the upper hand. As Garcia Marquez told Jon Lee Anderson of The New Yorker, who profiled him in 1999, ""Fidel trusts Mercedes even more than he does me.""

""It was one of those epic marriages,"" Mr. Anderson said in a phone interview. ""Mercedes ran the practical side. She unmoored him from the quotidian exigencies of everyday life."" Each of their homes, he recalled, was identically decorated, with white furniture and carpets, modern art, the same clothes in the closet and the same Apple computer. ""There's a Spanish phrase: 'polo a tierra,' the thing you ground a house with,"" Mr. Anderson said. ""She was his grounding, his connection to the earth."" ""She was also insatiably curious about the world and its goings-on; they both were,"" he added, ""and they were wise-eyed in this very intrinsic way. They came from a similar part of Colombia, from these little backwater river towns where violence was a fact of everyday life."" Mr. Garcia said his parents ""had this idea of marriage that was also a kind of complicity. It wasn't just the love, it was the things that were just between the two of you. ""People say she was the gatekeeper,"" he continued. ""I think that's a little facile. There is a gatekeeper when there is a gate to be kept. She was comfortable playing the bad guy, but if my father wasn't picking up the phone, it wasn't because she was keeping him away from it. It was because he was not going to take your call today."" In addition to Mr. Garcia, a film and television writer and director, Ms. Barcha is survived by another son, Gonzalo Garcia Barcha, an artist and graphic designer; and a brother, Eduardo Barcha. Gabriel Garcia Marquez, who died in 2014, often said, ""If Mercedes dies first, I'm going to move to a hotel.""","For nearly 60 years, she was the Nobel Prize-winning novelist's companion and inspiration, his sharp-witted foil and his chief of staff.",23348aa1-6fa8-5ca8-a875-71fe704e6dd2,https://static01.nyt.com/images/2020/08/24/obituaries/21Barcha1/21Barcha1-facebookJumbo.jpg?year=2020&h=550&w=1050&s=cf18d8ecc56c3981ff7385ede90c7816863d7a20c98c6860e51aa5caf3e239a8&k=ZQJBKqZ0VN,"Mercedes Barcha and her husband, the Colombian novelist Gabriel Garc&iacute;a M&aacute;rquez, in 2007. &ldquo;Mercedes permeates all my books,&rdquo; Garc&iacute;a M&aacute;rquez once said. &ldquo;There&rsquo;s traces of her everywhere.&rdquo;",23348aa1-6fa8-5ca8-a875-71fe704e6dd2,/Demo_data/D1_imgs_1/23348aa1-6fa8-5ca8-a875-71fe704e6dd2.jpg,13
Opinion,The George Floyd Election,https://www.nytimes.com/2020/06/03/opinion/george-floyd-trump-biden.html,"Mike Erlandson, a former chairman of the state's Democratic-Farmer-Labor Party, told Politico that the rioting could convert two relatively safe suburban Minneapolis-St. Paul Democratic House seats into competitive battlegrounds: Both of those districts will be decided in large part by suburban women voters, and it would be hard for me to imagine those people aren't watching this scared, like everybody else, for their family and for their children. What Democrats fear most is a repetition of the voter reaction to urban rioting in the 1960s that brought an end to decades of Democratic hegemony at every level of government as Republicans were able to set much of the federal, state and local agenda for the next 52 years. The transformation of voting patterns that manifested in the 1968 election is documented by Omar Wasow, a political scientist at Princeton. In his May 2020 paper, ""Agenda Seeding: How 1960s Black Protests Moved Elites, Public Opinion and Voting,"" Wasow compared voting in predominately white counties close to violent protests in 1968 to those that were not. Violent protests likely caused a 1.6 percent to 7.9 percent shift among whites toward Republicans and tipped the election. In contrast, the Democratic vote in white counties that directly experienced, or were in proximity to, nonviolent protests rose by 1.6 percent. Based on these calculations, Wasow estimated what the outcome of the 1968 election would have been under a ""counterfactual scenario that Martin Luther King had not been assassinated on April 4, 1968 and 137 violent protests had not occurred in the immediate wake of his death."" Under this scenario, Wasow wrote, ""Hubert Humphrey would have won an additional 763,040 votes nationally,"" including a majority of the votes in five additional states: Delaware, Illinois, Missouri, New Jersey, and Ohio. These swing states would collectively have provided Humphrey with an additional 84 electoral votes and allowed him to win the 1968 election with a total of 275 electoral votes. The current situation not only raises Democratic concerns over a repetition of 1968, but also a repetition of 2016.

They note that other studies have found that political violence is associated with a ""backlash"" effect; voters behave unsympathetically toward the perceived rioting group. In the United States, this means increased support for socially and politically conservative candidates and policies. Ryan, Kaufman and Sands write that reasons for ""the differences between our findings and prior research"" include the possibility that ""a single riot invokes sympathy"" while ""a series of riots provokes backlash."" In addition, ""those observing the riot from afar may lack sympathy because they do not share an identity with the rioters."" Interestingly, the profound levels of partisan polarization that obtain in 2020 are likely to lock voters into support for the candidates of their chosen political party. The freezing of millions of votes before the contest even begins means that a much smaller share of the electorate can be swayed by new developments, making the impact of urban disorder much less than it was in 1968, when voters' attachment to political parties was less intense. In a January 2020 paper, ""Cross-Country Trends in Affective Polarization,"" three economists, Levi Boxell and Matthew Gentzkow, both of Stanford, and Jesse M. Shapiro, of Brown, measured voter polarization from 1978 to 2018. They found that the level of polarization in the United States nearly doubled over those four decades, increasing at a much faster pace than in eight other developed nations, Canada, Switzerland, New Zealand Australia, Britain, Norway, Sweden, and German. While Democrats struggle to capitalize on their strengths and compensate for their vulnerabilities, the most challenging political terrain involves questions of race. Brian Schaffner of Tufts University argues that the current prominence of racially charged issues may cost liberals some votes: November is a long way off, and it is very possible that these protests will be a distant memory by then and that a new coronavirus outbreak or continued economic crisis will be the main talking points as the election nears. Then he added another thought: That said, it's possible that the protests will help Trump. In 2018, Democrats won back some of the Obama-Trump voters, and those Obama-Trump voters that they won back looked like the Democratic base on many issues, but were much farther away from the party's base when it came to issues of race. in general like the Democratic Party's positions on bread and butter economic and social welfare politics, but seem to be less comfortable with the racial justice platform. So elevating the salience of the latter may drive some swing voters back to Trump. Schaffner provided data showing that voters who backed Obama in 2012 and Trump in 2016 are close to mainstream Democrats on such issues as banning assault weapons and Medicare for All. They are, however, substantially more conservative that the Democratic base electorate on issues of white privilege and the border wall.

will look at all of the chaos happening in the United States right now -- protests, violence, coronavirus, economic crisis -- and simply decide that Trump is just not up to the job. With the situation as it is, there may be a desire among many to put the country in the hands of an experienced professional politician like Biden. What makes the moment unique is that the combination of widespread racial discontent, the pandemic and the economic implosion is taking place at a time when the scope of deprivation and need is extraordinary. The number of people who are out of work without income now tops 40 million. There is the prospect of an ""avalanche of evictions"" forcing millions of renters into homelessness as legal protections and government assistance come to an end. The University of Chicago's Becker Friedman Institute estimates that ""42 percent of recent layoffs will result in permanent job loss."" Families will increasingly begin to experience the incalculable depth of loss as the election approaches, and traditional political maneuvering will be subordinated to the less familiar and highly volatile politics of scarcity. Scarcity can bring out the best and the worst in us, but with Trump in the White House for the next seven months the likelihood of a beneficial outcome is slim to none. Trump's behavior this week has prompted extreme fear among some of those on the left. ""Authoritarians, often mentally unstable people with deeply narcissistic needs, transform this kind of chaos into dictatorships,"" David Leege, a professor emeritus of political science at Notre Dame, wrote in an email. Leege suggested that the president's actions Monday night offer a parallel to the rise of fascism in the 1930s, when Trump signaled his intent to seize power, sending troops to any state where the governor did not mobilize the forces of order to physically beat back and punish harshly any protesters who did not desist. To model for the nation his strength, he called out the troops to restore order to Washington, D.C. How the protests, both peaceful and violent, will play out on Nov. 3 remains uncertain. Perry Bacon Jr., a senior writer at FiveThirtyEight.com, points out that over the last decade, many whites, especially white Democrats, ""have become increasingly conscious of discrimination against black Americans -- particularly in the years since Trayvon Martin was shot and killed in 2012 and Michael Brown was shot and killed in 2014."" The looting of drugstores and high-end retail -- much of it videotaped and repeatedly broadcast -- may undermine the strength of these emerging liberal convictions. But will that matter more than Floyd's stark death, which also exists on tape for all to see?",How the protests come to be viewed may determine who the next president is. The way that will play out could surprise us.,32d42c23-4bd8-504a-8151-912b4c3f002d,https://static01.nyt.com/images/2020/06/03/opinion/03edsall1/03edsall1-facebookJumbo.jpg?year=2020&h=550&w=1050&s=3d5d07fbba34a3ced9dc75ae7f4e3ab7960b543214faec93c4ef55dc1f9ae24a&k=ZQJBKqZ0VN,Protests over the killing of George Floyd in New York City on Monday.,32d42c23-4bd8-504a-8151-912b4c3f002d,/Demo_data/D1_imgs_1/32d42c23-4bd8-504a-8151-912b4c3f002d.jpg,11
Books,"For Black and Mixed-Race Women, Hair and Identity Are Tangled Together",https://www.nytimes.com/2020/03/17/books/review/that-hair-djaimilia-pereira-de-almeida.html,"What do we lose in translation? How do we know we're getting the story right? In the Portuguese writer 's slim third novel, ""That Hair,"" this question feels particularly salient, given the nontraditional structure of the narrative. Even in its English translation (from a language that Eric M. B. Becker, the translator, calls ""at odds"" with this one), Pereira de Almeida's semi-autobiographical ""hybrid novel"" is a challenging read. It feels less like a novel than a collection of essays linked together by the author's preoccupation with her hair -- or, rather, the hair of her narrator, Mila. But as anyone blessed to be black knows, one's identity is inextricably wound up in one's hair. Fact or fiction, that is ultimately what this book is all about.

Mila begins by telling us, ""The story of my curly hair intersects with the story of at least two countries and, by extension, the underlying story of the relations among several continents: a geopolitics."" The daughter of a blond Portuguese father and a Black Angolan mother, Mila leaves her native Angola at the age of 3 to live with her paternal grandparents in Lisbon. We learn that Mila's mother has remained in Africa, to visit her daughter only occasionally, but the details about her mother's life, and how this absence unmoors Mila, are frustratingly scarce.

Instead Pereira de Almeida chooses to contextualize Mila's arc using the paths her paternal and maternal grandparents took separately and together, crisscrossing Portugal's African colonies to eventually arrive in Lisbon. It's a fascinating back story, offering a glimpse into the legacy of colonialism, but tracing her ancestors' journeys from Africa to Europe doesn't quite help Mila understand her own place in the world.","In ""That Hair,"" the Portuguese writer Djaimilia Pereira de Almeida uses a young half-Angolan girl in Lisbon to explore her own Afro-European selfhood.",7e7703aa-4180-57a3-9781-c74a25d31afb,https://static01.nyt.com/images/2020/03/22/books/review/22Tharps1/Tharps1-facebookJumbo.jpg?year=2020&h=550&w=1050&s=bfe3c45923c489b7d086330685fb31a4b0e9e7b3c80f6f051fc20d60b5504f2f&k=ZQJBKqZ0VN,Djaimilia Pereira de Almeida,7e7703aa-4180-57a3-9781-c74a25d31afb,/Demo_data/D1_imgs_1/7e7703aa-4180-57a3-9781-c74a25d31afb.jpg,13
Books,A Contemporary Feminist Spin on the Traditional Pioneer Novel,https://www.nytimes.com/2019/07/08/books/review/madeline-ffitch-stay-and-fight.html,"Motivated in part by guilt as a privileged outsider, Helen invites a local lesbian couple, Lily and Karen, and their newborn son, Perley, to join her on the land. For years they share an insular, antisocial utopia, united by their anticapitalist eagerness to eke out an existence eating boiled nettles and acorns. Forget other people, Lily decides after the three of them construct a ramshackle cabin, which is promptly infested by black snakes: ""It was each other we wanted.""

[ This book was one of our most anticipated titles of July. See the full list. ]

Karen and Lily call their parenting style ""dignity of risk,"" and when 7-year-old Perley is bitten by one of the snakes, the family is cast out of paradise and into disarray. Seeing his face wound, the school principal reports the family to Children's Services, whose agents remand the boy to foster care. To get him back, Karen joins an oil-pipeline crew to earn enough cash for court-ordered property improvements. There she discovers the pipeline is headed right for Helen's land, where construction could eventually devastate their land and force them all to flee.

In a 2017 essay for Granta, ffitch recounted her own family's experience attending protests against the Dakota Access Pipeline in North Dakota, ominously nicknamed the ""black snake."" She's borrowed that image to serve as the central metaphor of her novel, the snake that bites Perley mirroring the danger of the pipeline that slithers toward Helen's land.

At the novel's climax, the snakes both metaphorical and literal seem poised to destroy this backwoods Eden. An exasperated Karen has quit her crew in defeat; Perley remains in foster care, ""hopped up on some kind of meds."" When Karen firebombs a compressor station that services the pipeline, the act seems less heroic than desperate. ""Too bad that kind of thing doesn't create lasting change,"" Helen remarks upon reading of the eco-sabotage in the newspaper.

In that Granta essay, ffitch described the tension between activism and fiction. ""Rather than claiming certainty or authority where none exists, storytellers stay honest by writing about what we ourselves don't fully understand."" ""Stay and Fight"" succeeds in mapping the obscure psychological and emotional territory that defines a life caught between commitment and ambivalence, between rebellion and resignation.","In Madeline ffitch's debut, ""Stay and Fight,"" an urbane hipster finds herself when she relocates to Appalachia.",c030fbee-2601-54f5-a9df-75fa8c13368c,https://static01.nyt.com/images/2019/06/27/books/review/Enzinna1/Enzinna1-facebookJumbo.jpg?year=2019&h=226&w=432&s=8ea1d7a80d891280731fa6443cbdef64247d3cc6ad59ae91c14d8289c2f7747e&k=ZQJBKqZ0VN,"Madeline ffitch's debut novel, ""Stay and Fight,"" succeeds in mapping the peculiar psychological territory that defines a life caught between commitment and ambivalence.",c030fbee-2601-54f5-a9df-75fa8c13368c,/Demo_data/D1_imgs_1/c030fbee-2601-54f5-a9df-75fa8c13368c.jpg,13
