section,headline,article_url,article,abstract,article_id,image,caption,image_id,image_path,section_numeric
Media,Minnesota Public Radio Drops Garrison Keillor Over Allegations of Improper Conduct,https://www.nytimes.com/2017/11/29/business/media/garrison-keillor-fired.html,"Minnesota Public Radio said Wednesday that it was severing all business ties with Garrison Keillor, the creator and retired host of ""A Prairie Home Companion,"" after allegations of ""inappropriate behavior with an individual who worked with him."" Over four decades, Mr. Keillor, 75, had created a financial juggernaut for the radio network with his weekly broadcast of songs, skits and tales of his fictional hometown Lake Wobegon, along with related books, recordings and other products. In a statement he provided to The New York Times, Mr. Keillor said, ""I've been fired over a story that I think is more interesting and more complicated than the version MPR heard. Most stories are."" Effective immediately, MPR said, it will no longer distribute and broadcast Mr. Keillor's remaining programs, ""The Writer's Almanac"" and ""The Best of A Prairie Home Companion Hosted by Garrison Keillor.""

It will also change the name of American Public Media's current incarnation of the show, which Chris Thile, a songwriter and mandolinist, took over in October 2016, after Mr. Keillor stepped down. Jon McTaggart, the president of Minnesota Public Radio, said in a statement that ""all of us in the MPR community are saddened by these circumstances."" He added: ""While we appreciate the contributions Garrison has made to M.P.R., and all of public radio, we believe this decision is the right thing to do and is necessary to continue to earn the trust of our audiences, employees and supporters of our public service."" The network did not elaborate on what it called Mr. Keillor's ""inappropriate behavior."" Later on Wednesday, The Star Tribune of Minneapolis published an email from Mr. Keillor in response to a reporter's questions, giving his version of an encounter with an unidentified woman. ""I put my hand on a woman's bare back,"" he wrote. ""I meant to pat her back after she told me about her unhappiness and her shirt was open and my hand went up it about six inches. She recoiled. I apologized. I sent her an email of apology later and she replied that she had forgiven me and not to think about it.""

Mr. Keillor claimed that they continued to be friends ""right up until her lawyer called."" He insisted his discomfort with physical affection was common knowledge, adding, ""If I had a dollar for every woman who asked to take a selfie with me and who slipped an arm around me and let it drift down below the beltline, I'd have at least a hundred dollars."" Mr. Keillor is one of many public figures to face consequences after allegations of sexual misconduct in recent weeks. Indeed, just a day earlier, he had come to the defense of his friend and fellow Minnesotan, Senator Al Franken, who is fighting for his political life in the face of accusations of improprieties from four women. In an op-ed for The Washington Post published on Tuesday evening, Mr. Keillor said calls for the senator's resignation were ""pure absurdity"" and dismissed a photograph of the Democrat with his hands on a woman's chest as something ""in a spirit of low comedy.""
* Ford and Rivian no longer plan to work jointly on electric vehicles.
* Elizabeth Holmes took the stand in her trial. Follow along with our reporters.
* Ken Griffin, head of Citadel, bid highest for a copy of the Constitution. The fallout with the network came as Mr. Keillor was slowly receding from the public stage, though he has still been touring, with appearances around the Northeast this week. On Wednesday, he canceled a performance scheduled that night in Pittsfield, Mass. He originally came up with the idea for his own Americana variety program in 1974 after he traveled to Nashville to write about the Grand Ole Opry for The New Yorker. ""A Prairie Home Companion"" became a radio institution, peaking at 4.1 million weekly listeners a decade before he retired, with lucrative live performances and merchandise that included recordings, books and clothes.

Mr. Keillor sang, performed in skits with recurring characters like Guy Noir and ended each show with a monologue about Lake Wobegon, ""where all the women are strong, all the men are good looking and all the children are above-average."" Famous artists who appeared on his stage included Emmylou Harris, Chet Atkins, Gillian Welch and David Rawlings, Taj Mahal, Bonnie Raitt, Willie Nelson, Keb' Mo' and Wilco. He was credited with shaping the early profile of public radio. ""'Prairie Home Companion' came on the scene just as public radio was trying to figure out what its identity was,"" Ira Glass, the host of ""This American Life,"" told The New York Times last year. ""The fact that here was such a visibly weird, funny, idiosyncratic show opened up the space of other weird, idiosyncratic shows, like 'Car Talk,' and our show."" Mr. Keillor, in his statement on Wednesday, which he also published on his website, said he was ""deeply grateful"" for all the years appearing on the radio and touring the country. ""It's some sort of poetic irony to be knocked off the air by a story, having told so many of them myself, but I'm 75 and don't have any interest in arguing about this,"" he said. ""And I cannot in conscience bring danger to a great organization I've worked hard for since 1969."" He also apologized to ""all the poets whose work I won't be reading on the radio and sorry for the people who will lose work on account of this.""","The network says it has severed all business ties with Mr. Keillor, the creator of ""A Prairie Home Companion.""",ffc5888c-af9f-5898-b5db-e838334b487e,https://static01.nyt.com/images/2017/11/30/business/30xp-Keillor/30xp-Keillor-facebookJumbo.jpg?year=2017&h=549&w=1050&s=a80952347be8286a7a3779bd429077934b21b74a521984eef77af2a0c3f813a9&k=ZQJBKqZ0VN,Garrison Keillor in 2016.,ffc5888c-af9f-5898-b5db-e838334b487e,/Demo_data/D1_imgs_1/ffc5888c-af9f-5898-b5db-e838334b487e.jpg,16
Automobiles,"Working in Postwar Italy, He Was the da Vinci of the V6",https://www.nytimes.com/2014/12/14/automobiles/working-in-postwar-italy-he-was-the-da-vinci-of-the-v6.html,"The question of which engine type is best for powering the cars of the masses may never have a single, unchanging answer. When the V8 prevailed on American roads, it was an appropriate choice for large vehicles in an era of cheap fuel. Times have changed; the workhorse auto engines of our era are those that fit in the narrow engine compartments of the millions of front-wheel-drive cars. For that reason, the V6 has become ubiquitous in full-size family sedans, and in-line 4 cylinders have come to dominate the overall market as vehicles shrink. Many factors have been considered in establishing these norms. The in-line 6, once dominant, is still favored by BMW and others because of its naturally smooth operation, but aside from a handful of exceptions, it is too long to fit under the hood of front-drive models.

In-line 4s that typically power small front-drive cars are attractive to automakers; with fewer parts, they are cheaper to build. But such engines have shortcomings. Their natural imbalance requires the complication of a counterbalancer system to offset vibration, and their less-frequent firing pulses -- two per revolution, or half as many as a V8 -- can generate a driveline vibration felt by passengers under some driving conditions. That makes engines with more cylinders desirable, but they must be contained in a package of short overall length. Today's answer is a V6 engine. These same requirements existed in the late 1930s at Lancia, a small Italian manufacturer. The company needed a smoother, more powerful engine that would fit into an existing, rather narrow engine bay. Lancia had previously solved such problems by building compact engines that arranged the cylinders in a narrow V shape, with both cylinder banks sharing a single cylinder head. Such extreme compactness compromised performance (though Volkswagen was later successful in adopting a similar scheme for its VR6 engine). Something new was needed. Lancia had been founded in 1906 by a racing driver, Vincenzo Lancia. The company made its place by building cars known for exceptional construction and driving qualities, yet priced below the top end of the expanding auto market. (Lancia became part of Fiat in 1969.) The company was a pioneer of unit body construction and 4-wheel independent suspension.

A young engineering graduate, Francesco De Virgilio, was hired at Lancia in 1939 and put to routine tasks. He soon attracted management's attention by improving and simplifying the suspension of a Lancia model. In 1941 he was transferred to the test department, working under Vittorio Jano, one of the outstanding designers of the 20th century. De Virgilio spent the summer of 1943 analyzing the vibration of alternative V-angles for a possible V6 engine. Engine balance been given little attention in the early days of motoring because engine speeds, and therefore shaking forces, were low, but as engines were made smaller and higher-revving, controlling vibration became more important. Today, engineers let their computer workstations pop out solutions to deal with vibration problems. Easy answers of this kind have been a blessing and a curse. They are a blessing because junior engineers no longer need to spend weeks in pencil-and-paper calculation as De Virgilio did. They are a curse because instant computer solutions do not confer the insight that De Virgilio gained. De Virgilio's career is chronicled in a new, generously illustrated book, ""Lancia and De Virgilio at the Center,"" by Geoffrey Goldberg (David Bull Publishing, 2014). The book has the graceful quality and range of an artist's biography, properly treating De Virgilio's entire life as relevant to his work. He is depicted with his family, at work and at the racetrack. (Fangio was a Formula One champion in the Lancia D-50, fielded by Ferrari, in 1956.) There are reproductions of many of his sketches and drawings as well as photos of the hardware he created. De Virgilio showed his superiors that a V6 with its cylinder banks positioned at a 60-degree V angle and a crankshaft with six crankpins -- the section where the connecting rods attach -- spaced at 60-degree intervals could be made uniquely smooth-running. There was official resistance to his conclusion, because, as the automotive historian Karl Ludvigsen has noted, the V6 was a ""virtually unknown engine type in the 1950s."" Even so, Lancia's team built, evaluated and rejected as less smooth alternative designs before accepting De Virgilio's solution. In the end, Jano, Lancia's chief engineer, chose De Virgilio's V6 to power the very influential 1950 Lancia Aurelia. De Virgilio's solution was a crankshaft with four main bearings and six crankpins; his design resulted in evenly spaced firing intervals and a low-vibration power plant. (By contrast, many of the V6s that followed were built like V8s, with pairs of connecting rods bolted side-by-side on each of the three crankpins.)

Offsetting the crankpins, as De Virgilio did, weakened the crankshaft because each pair of crankpins was joined to a disc between them, with almost no overlapping metal between each pair of pins. Like most engineering decisions, this was a compromise; at the engine speeds prevalent in that era, the engines were reliable, and the result was a new kind of smooth, compact automotive power plant. The Aurelia it powered was a streamlined sporting sedan that strongly influenced subsequent European auto design. When, in 1956, Enzo Ferrari wanted a head-start on 1957's new Formula Two racing class, he engaged Jano as a consultant. With the Aurelia's competition success in mind, a six-crankpin V6 to power the Ferrari racecar was drawn up, widening the V angle to 65 degrees to make room for three dual-throat carburetors. Later production V6 auto engines had a less elegant origin -- as utilitarian cost-cutters. Buick built an aluminum V8 during the early 1960s (later used in Land Rovers), but it was expensive. The project manager, Joseph D. Turlay, made a simplifying proposal: Chop off two cylinders to make a shared-crankpin V6 and give it a low-cost iron block. This saved money by allowing V6s to be produced on modified V8 tooling, even though the result was neither ideally balanced (the engines are sometime called paint shakers) nor did it have an even firing interval. These shortcomings were masked by the use of soft engine mounts. Buick's first Fireball V6 arrived in 1962, and a smoother even-fire engine with six separate crankpins came late in 1977. De Virgilio's V6 work was modern in the sense that he was trying to package engine functions to fit external requirements. Automakers in need of a short engine with more than 4 cylinders have made millions of 90-degree V6s, saving money by sharing tooling with V8s. Those compromise V6s were not as smooth as De Virgilio's solution of 1943 -- a configuration now broadly embraced -- but they were effective automobile power plants.","An innovative design by Francesco De Virgilio, introduced more than 60 years ago, is the basis for many modern 6-cylinder engines.",f7af67a1-d43a-5949-a837-1fcc7f8b2a98,https://static01.nyt.com/images/2014/12/14/automobiles/14ENGINE3/ENGINE3-articleLarge.jpg?year=2014&h=692&w=600&s=81edea041518474f1f7b5b67e92ca857a8ee3ca1c14645b495eaafa5b5955273&k=ZQJBKqZ0VN&tw=1,Francesco De Virgilio in 1990 with his V6.,f7af67a1-d43a-5949-a837-1fcc7f8b2a98,/Demo_data/D1_imgs_1/f7af67a1-d43a-5949-a837-1fcc7f8b2a98.jpg,23
Television,What's on TV Tuesday: 'Adam Ruins Everything' and 'The Standups',https://www.nytimes.com/2018/03/20/arts/television/whats-on-tv-tuesday-adam-ruins-everything-and-the-standups.html,"Adam Conover wants you to unlearn everything you thought you knew about global history. And a new set of breakout comics performs in the second season of ""The Standups.""

ADAM RUINS EVERYTHING PRESENTS: REANIMATED HISTORY 10:30 p.m. on truTV. An animated Adam Conover debunks historical myths in this midseason premiere of his sketch-comedy show. His first target: the American Revolution. ""The truth is, the Continental Army wasn't made up of patriots,"" he tells an invisible narrator. ""It was mostly drunks, immigrants and poor farmers looking to get paid.""

THE PIZZA SHOW 7 p.m. on Viceland. The host and pizza aficionado Frank Pinello stops in the San Francisco Bay Area for mouthwatering vegetable pies in this season finale.

FRESH OFF THE BOAT 8:30 p.m. on ABC. Season 4 wraps up with what should be a relaxing getaway for Honey (Chelsey Crisp) and Jessica (Constance Wu), until Jessica turns it into a mission to persuade Stephen King to endorse her horror novel. Louis (Randall Park) goes to extreme measures to convince his mother she's welcome in his home, and Eddie (Hudson Yang) and Nicole (Luna Blaise) rebel against a school dance dress code.","Adam Conover wants you to unlearn everything you thought you knew about global history. And ""The Standups"" returns on Netflix.",39338f30-592e-5141-95d0-4c3e11bda73d,https://static01.nyt.com/images/2018/03/20/arts/20tvcol-adam/20tvcol-adam-facebookJumbo.jpg?year=2018&h=549&w=1050&s=7d9f9da87edd5a36b5aeda7adb09e3d2b493b9017f4a92c1254be2d29a60f0cc&k=ZQJBKqZ0VN,A scene from &ldquo;Adam Ruins Everything Presents: Reanimated History.&rdquo;,39338f30-592e-5141-95d0-4c3e11bda73d,/Demo_data/D1_imgs_1/39338f30-592e-5141-95d0-4c3e11bda73d.jpg,3
Automobiles,'Rush': The Drama Is Off the Track,https://www.nytimes.com/2013/09/15/automobiles/rush-the-drama-is-off-the-track.html,"Hollywood has long tried to make films about auto racing that would strike a chord with general audiences. So far, the commercial successes have been few -- and, with rare exceptions, the racing has served as little more than a noisy background that fed speed and thrills to another story line. ""I mean, there's John Frankenheimer's 'Grand Prix' from 1966, and that's about it,"" Mario Andretti said in a telephone interview, adding that he had seen almost every racing movie made. ""Grand Prix"" won three Academy Awards for technical achievement; an auto racing movie has never won an Oscar for Best Picture. ""I'm sorry, that's it,"" Andretti said, offering a critique informed by the many championships to his credit. But that bleak assessment could change. Andretti said he had hope for the prospects of the new Ron Howard film, ""Rush,"" which chronicles the 1976 Formula One season and the duel between Niki Lauda and James Hunt for that year's driver championship. The movie opens nationwide on Sept. 27.

""It was probably a good choice for subject matter on the part of the filmmakers,"" said Andretti, whose opinion carries extra weight because he raced, and won, against both men. Moreover, he won the 1976 Japanese Grand Prix, the climax of both the racing season and the movie. It was a season full of dramatic twists. Lauda had won five races when the circuit came to the Nurburgring for the German Grand Prix, where his Ferrari spun into a guardrail and caught fire. His helmet came off, and he suffered extensive burns. Though Lauda missed two races while he was hospitalized, he still led Hunt in World Championship points when, despite his painful injuries, he returned to competition just six weeks after the near-fatal crash. Pulling a helmet down over his burns was every bit as excruciating as depicted in the movie, Lauda said at the London premiere on Sept. 2. He said the movie was so realistic that it helped him to recall forgotten details of the crash. ""Although I never lost consciousness, I never realized what my rescuers were doing to try to keep me alive,"" he said. ""I was only concerned with my own survival.""

Although the battle for the championship was compelling in its own right, where the film has received the most praise is in the script and the highly charged chemistry between the actors who play the main characters -- Daniel Bruhl as the dour Lauda and Chris Hemsworth as the flamboyant Hunt. ""Most modern-era car racing movies, from 'Grand Prix' and 'Le Mans' to 'Days of Thunder', have been far stronger at portraying the excitement on the track than at developing interesting downtime drama among the characters,"" wrote Todd McCarthy of The Hollywood Reporter, noting that the reverse is true with ""Rush,"" which devotes far more time to exploring the personalities of the drivers. ""Mozart vs. Salieri. Kennedy vs. Khrushchev. Gates vs. Jobs,"" Variety's film critic, Peter Debruge, wrote, adding that ""Rush"" is ""not just one of the great racing movies of all time, but a virtuoso feat of filmmaking in its own right, elevated by two of the year's most compelling performances. It's high-octane entertainment that demands to be seen on the big screen, assembled for grown-ups and executed in such a way as to enthrall even those who've never watched a race in their life."" Closer to the sport, the retired Formula One driver David Coulthard said he found the racing scenes credible, although ""no film can quite capture what really goes on inside the car."" ""But I thought the characters were compelling and believable,"" Coulthard said in an interview at the Italian Grand Prix last week. ""I have a rather personal perspective on the two men, as I know Niki, of course, from my association with Mercedes, and I met James when I was a very young driver."" The fast-living Hunt died of a heart attack in 1993 at age 45. One of the few tempered comments about the movie or its performances came from Bernie Ecclestone, who controls the commercial rights to Formula One. At the Italian Grand Prix, Mr. Ecclestone said that no one could ever play Hunt like Hunt himself: ""He would have livened the film up a lot.""","Ron Howard's film, which chronicles the duel between Niki Lauda and James Hunt for the 1976 Formula One driver championship, has racing greats fired up.",0b5c86ae-81bd-5f9b-854a-d5a9b3c231f2,https://static01.nyt.com/images/2013/09/15/automobiles/Rush/Rush-articleLarge.jpg?year=2013&h=248&w=600&s=d600fe7a8133df23b0a1a310e65171dd2eea3be267f06deb16621d4544ca4fc1&k=ZQJBKqZ0VN&tw=1,"MOODY  On-track clashes play a role, but it's the driver personalities that distinguish ""Rush"" from other racing films.",0b5c86ae-81bd-5f9b-854a-d5a9b3c231f2,/Demo_data/D1_imgs_1/0b5c86ae-81bd-5f9b-854a-d5a9b3c231f2.jpg,23
Opinion,Who Bears Witness to a Hidden Epidemic?,https://www.nytimes.com/2020/07/14/opinion/sunday/domestic-violence-coronavirus.html,"We know domestic violence is spiking under lockdown -- we just don't know the details. Here are women who do.

Within the first few weeks of states' going into lockdown, reports began flooding in from domestic violence hotline centers throughout the country: They were seeing spikes in calls. But as sheltering-in-place dragged on, the calls for help dropped off. To those familiar with the dynamics of intimate-partner violence, this was not a good thing.

That domestic violence is part of the story of this pandemic is well known: Lockdowns have made it more difficult for domestic violence survivors to distance themselves from their abusers; orders of protection often take longer to come through because courts aren't operating at full capacity; experts have viewed the decline in calls for help with alarm, as it suggests survivors might not be able to get away from abusers long enough to reach out.

But if covering domestic violence, which takes place mainly behind closed doors, is difficult in normal times, telling the story of its rise during a time of lockdowns and quarantines poses an even bigger challenge. That is why Christopher Lee, a photographer, opted to focus on the hotline workers. He began photographing them in the Austin, Dallas-Fort Worth and Houston metro areas in May. According to Dr. Noel Busch-Armendariz, director of the Institute on Domestic Violence and Sexual Assault at the University of Texas at Austin, 38 percent of adult women in Texas in 2011 reported having been in an abusive relationship. The stay-at-home orders have had a severe effect on the most vulnerable women, and domestic violence centers are bracing themselves for the worst. In Texas, which reported record numbers of daily cases of Covid-19 four times last week, the governor signaled on Friday the possibility of a new economic ""lockdown"" if the state cannot curtail its outbreak.

Like so many people around the globe, those who answer phones for domestic violence hotlines are working from home during the coronavirus pandemic. With the benefit of technology, advocates and counselors have been fielding calls, texts and emails from survivors from their kitchen tables and living rooms. Their experiences on one end of these calls help shed light on stories going untold.

Veronica Hernandez, a hotline operator and advocate at SAFE Austin, says she's seen an uptick in reports from a wider array of survivors than usual: men who've been abused, youth who've been trafficked and people who've been hurt by nonromantic partners such as roommates. She's also sensed that those who call have grown more desperate -- she hears more frequently from women who are actively fleeing danger or have already had violent interactions with their abuser. Before the pandemic, callers would be more likely to say they had experienced non-life-threatening behavior or abuse, such as emotional or psychological abuse or behavior that could evolve into something violent. Now they are getting calls that go from zero to 60 in an instant.

As the stories have grown more desperate, the work has grown more challenging. Hotline workers who once counted on the commute between office and home to decompress from stressful professional lives no longer have that sense of separation. ""Bystander trauma is real,"" said Milisa Alexis-Flores, the managing attorney for the Houston office of Aid to Victims of Domestic Abuse, a nonprofit that provides legal aid to domestic violence survivors. ""We all experience it doing this line of work when you consume other people's trauma for a living. That's just the nature of the job and it's always challenging, but it's more challenging in a different way when you're doing it at home.""

But ""I at least am still able to try to decompress in the safety of my home, which my client cannot do,"" Ms. Alexis-Flores said. These images don't quite shed light on the domestic violence that is currently on the rise in private spaces around the world. What they do highlight is the parallel world of the hotline operators, working from their homes, speaking over the phone to survivors calling from rooms that at first glance probably look very similar; what sets them apart is the danger.",We know domestic violence is spiking under lockdown — we just don't know the details. Here are women who do.,e05685c9-6cca-5415-94c4-b4977e4fbcea,https://static01.nyt.com/images/2020/07/19/opinion/00lee9/merlin_173557341_dd5b72b5-9ef1-4390-9b35-6a3044a7bde5-facebookJumbo.jpg?year=2020&h=550&w=1050&s=b86d6f38facadf011cfc9ab5117be8869ca2cfd2fd830edb3715d3e415999b37&k=ZQJBKqZ0VN,"Latrice Brooks, a crisis interventionist, working alone in the SafeHaven office in Fort Worth.",e05685c9-6cca-5415-94c4-b4977e4fbcea,/Demo_data/D1_imgs_1/e05685c9-6cca-5415-94c4-b4977e4fbcea.jpg,11
