section,headline,article_url,article,abstract,article_id,image,caption,image_id,image_path,section_numeric
Fashion & Style,"On This Runway, Non-Models and Cool Kids",https://www.nytimes.com/2016/09/10/fashion/eckhaus-latta-casting-new-york-fashion-week.html,"Over Labor Day weekend, a steady stream of hopefuls arrived at Eckhaus Latta's basement studio in Chinatown for the chance to take an audition strut down a makeshift runway.

New York Fashion Week was days away, and Mike Eckhaus and Zoe Latta, the designers of Eckhaus Latta, and their casting director, Rachel Chandler, were surveying the talent (male, female and nonconforming) hoping to appear in their fashion show on Sept. 10.

Eckhaus Latta is an anomaly among the trendy sportswear labels that otherwise populate New York Fashion Week. Mr. Eckhaus and Ms. Latta, both 28, founded it in 2011, straight out of the Rhode Island School of Design, where neither had studied fashion (he, sculpture; she, textiles). And it maintains an air of art school (there is much talk of various ""creative practices"" and their ""process-oriented"" praxis).

Their designs have been exhibited at the hipper museums of the coasts -- at MoMA PS1, in New York, and the Hammer Museum, in Los Angeles -- and their shows often have the flavor of an old-school ""happening."" (Their last show was held at PS1, at 9:30 p.m., on a weekday night mid-fashion week, in a snowstorm. Hundreds turned up anyway.)",How the Eckhaus Latta designers select fashion week's coolest cast.,e9cd6477-5eb6-58b2-8e33-fd2d881bf656,https://static01.nyt.com/images/2016/09/10/fashion/10ECKHAUS-WEB1/10ECKHAUS-WEB1-facebookJumbo.jpg?year=2016&h=550&w=1050&s=650df93b3e54b1d21163675e9fbff3d34391b30c94d95df3894a16482eec6e6d&k=ZQJBKqZ0VN,"Mike Eckhaus, center right, and Zoe Latta, center left, of the fashion label Eckhaus Latta.",e9cd6477-5eb6-58b2-8e33-fd2d881bf656,/Demo_data/D1_imgs_1/e9cd6477-5eb6-58b2-8e33-fd2d881bf656.jpg,19
Theater,"The New 42nd Street, a Theater Nonprofit, Names Its Next Leader",https://www.nytimes.com/2019/06/11/theater/new-42nd-street-russell-granet.html,"The New 42nd Street -- the nonprofit organization behind the New Victory Theater, the New 42nd Street Studios and the Duke on 42nd Street -- has named Russell Granet as its new president and chief executive officer.

Until May, Mr. Granet was the acting president of Lincoln Center, where he had run the education and community engagement division and served in other leadership roles. He will start at the New 42nd Street in July. ""I couldn't imagine a better position or a better place to work,"" Mr. Granet said in an interview .

Mr. Granet will follow on the heels of the organization's longtime leader Cora Cahan, who is stepping down after about 29 years. Under her tenure, in the 1990s, the organization spearheaded the restoration of seven historic theaters on 42nd Street and helped to transform the street into a cultural hub . The New 42nd Street also opened three spaces in the area: the family theater the New Victory, which offers shows for children at prices sometimes as low as $2; the New 42nd Street Studios, which gives emerging artists a much-sought-after rehearsal site to create new work; and the Duke, a black-box theater available for rental.

Mr. Granet said that as leader of the New 42nd Street, he'll focus on commissioning new work. He said he will prioritize offering the New 42nd Street Studios as an incubator space for projects by emerging artists and using the Duke to stage those works.","Russell Granet will be the new president and chief executive of the organization, taking over as Cora Cahan steps down.",acdcd1ef-71a9-55f2-9993-7a231d57396f,https://static01.nyt.com/images/2019/06/11/arts/11new42-item/11new42-item-facebookJumbo.jpg?year=2019&h=549&w=1050&s=51f9691b9923b0bc48ba24502080cef57ea96e060732b95f66a0814323950174&k=ZQJBKqZ0VN,"The New 42nd Street board chairwoman, Fiona Rudin, with Russell Granet.",acdcd1ef-71a9-55f2-9993-7a231d57396f,/Demo_data/D1_imgs_1/acdcd1ef-71a9-55f2-9993-7a231d57396f.jpg,10
Economy,Tax Tactics Threaten Public Funds,https://www.nytimes.com/2014/10/02/business/economy/multinational-tax-strategies-put-public-coffers-at-risk.html,"When the European Commission charged this week that Ireland's sweetheart tax treatment of Apple amounted to an illegal corporate subsidy, the company said that it had done nothing wrong. Apple executives might have added that whatever they did, they were not alone. Corporate tax strategies intended to minimize global taxes, by hook or by crook, are by now standard practice. Google and Facebook move money through Ireland to lower their taxes. Starbucks uses the Netherlands, a practice that is under review by Europe as well. ""The commission picked up a case which is quite common in terms of tax planning,"" said Pascal Saint-Amans, who runs the Center for Tax Policy and Administration at the Organization for Economic Cooperation and Development, the policy advisory organization of the world's advanced nations. The question is whether this sort of strategy -- as common to multinational companies as filing a tax return every year -- can truly be stopped. What hangs in the balance is whether governments can continue to tax corporations beyond the barest minimum. Or whether globalization will make such taxation all but impossible.

""A combination of greater economic integration and more income accruing to intangibles like intellectual property, which by nature are hard to locate, does raise profound questions for the future of taxation,"" said Lawrence H. Summers, Treasury secretary under President Bill Clinton and President Obama's first chief economic policy adviser. ""It is a significant problem for the revenue capacity of states and an immense problem for their capacity to maintain progressive taxation."" If corporations can continue to evade taxation -- using strategies like sham transactions between phantom subsidiaries to shift profits to the lowest tax jurisdictions and costs to where taxes are highest -- the burden of public finance will land almost entirely on the shoulders of ordinary workers, the only link in the economic chain that can't move. ""Consider a superstar banker, an enormously valuable pharmaceutical patent, a terrific entertainer, an assembly line worker and a teacher. Of all those things, which is the least mobile?"" asked Mr. Summers. ""A tax system that can't reach the mobile is a tax system that is going to burden working people."" Some scholars -- including Robert B. Reich, who served as Labor Secretary during the Clinton administration and now teaches at the University of California, Berkeley; and Greg Mankiw of Harvard, who was former chief economic adviser to President George W. Bush -- have proposed abolishing the corporate income tax, replacing it with direct taxes on shareholders. But it is highly doubtful that the American political system could raise taxes on dividends, capital gains and upper incomes enough to compensate for the lost revenue from business. Rich taxpayers also have their own sophisticated tools to shield income, including parking money in tax havens around the world.

Mr. Saint-Amans said he feared that without the corporate income tax, income taxation would fall apart entirely as the wealthy could avoid taxation by becoming companies, inserting several corporate layers between themselves and their money. Nobody has a confident grasp of the scale of corporate tax avoidance. Corporate tax revenue in the United States today amounts to some 2.6 percent of total economic activity, roughly the same as it did in the early 1980s, when the latest wave of globalization took off. Across the 34 O.E.C.D. nations, corporate tax revenue actually grew from just above 2 percent of G.D.P. in the 1960s to some 3.7 percent in 2007, before the financial crisis walloped companies around the world. These figures can be misleading, though. In the United States, corporate taxes have remained flat despite a sharp increase in corporate profits, which today take the highest share of national income since the government started measuring them in the 1920s. Profits have similarly risen in other industrial countries around the world. Plus, there is plenty of suggestive evidence that profit-shifting has become a core pillar of corporate strategy.
* Kevin Spacey was ordered to pay $31 million to the 'House of Cards' studio after sexual harassment allegations.
* Netflix buys a visual effects company in a move to support its global ambitions. In 2012 the Irish subsidiaries of American multinationals generated $120 billion in profit, according to United States government data, eight times as much as their German subsidiaries. Subsidiaries in Bermuda generated $82 billion, four times as much as subsidiaries in Mexico.

Americans seem to be the most nimble dodgers. The United States has a higher statutory corporate tax rate than Europe, but according to a recent study by Reuven S. Avi-Yonah of the University of Michigan Law School and Yaron Lahav of Ben-Gurion University of the Negev, European multinationals effectively pay a higher rate than their American counterparts. The problem is global. In 2010, according to the International Monetary Fund, Barbados, Bermuda and the British Virgin Islands received more foreign direct investment combined than Germany or Japan. The British Virgin Islands was the second-largest investor in China, after Hong Kong. These fictions are possible because most of the money flows through shell corporations that employ nobody and produce nothing. Can these problems be fixed? ""I think so,"" Mr. Saint-Amans said. ""The golden age of 'We plan aggressively and pay taxes nowhere' is over."" The European Commission's deployment of competition policy to go after dubious tax breaks in Apple's case is a novel and potentially powerful strategy, which could be applied to many other arrangements. Governments in both the rich and poor world are fed up, Mr. Saint-Amans said. Having spent the last few decades drafting rules to prevent double taxation, they are now terrified that they have built a system of double nontaxation instead. Governments that turned a blind eye to the tax avoidance of their multinational champions to give them a competitive edge against foreign rivals are now under enormous pressure from voters to prove that it's not only workers and dupes paying taxes.

The O.E.C.D., Mr. Saint-Amans says, has no business telling countries what tax rate they should impose. If the Irish can fund their government charging companies 12.5 percent, that's their business. Still, he trusts new rules developed by the O.E.C.D., if broadly adopted, could put an end to common avoidance practices, like parking valuable intellectual property in tax havens or having subsidiaries in high-tax jurisdictions, where interest is deductible, borrow from subsidiaries in low-tax jurisdictions where interest is not taxable. Under enormous pressure from the rest of the world, tax havens might even repent. The Irish, he said, have been mulling tightening the rules unilaterally, concluding that the bad blood generated by the arrangements outweighs the modest number of jobs that they lure and the scant tax revenue that these artificial investments leave in the country. There are reasons, however, to remain cautious that the world's tax collectors can get ahead of its corporate tax strategists. The trend in the United States, if anything, is going in the opposite direction. Despite the Obama administration's new rules to prevent so-called corporate inversions, where companies move their tax residency abroad, companies like Burger King and Medtronic are still dropping their American ""citizenship"" to reduce their tax liability. Ireland has based its entire development strategy on becoming a low tax base for the multinationals of the world. And until the financial crisis walloped its banks, it had been successful. As Mr. Summers pointed out, putting a stop to the shell company shenanigans doesn't automatically put an end to international tax competition. In fact, it might make it worse.","If global corporations can continue to evade taxation, the burden of government financing could fall disproportionately on ordinary workers.",1de5c156-9cea-5971-9fdf-b6a4ce9bf35c,https://static01.nyt.com/images/2012/02/29/business/eduardo-porter/eduardo-porter-articleLarge-v2.jpg?year=2014&h=900&w=600&s=e0f5bc829638945c9b9699e41305b013e6fb17053b1c05c78d9b02c6891b47ef&k=ZQJBKqZ0VN&tw=1,Eduardo Porter,1de5c156-9cea-5971-9fdf-b6a4ce9bf35c,/Demo_data/D1_imgs_1/1de5c156-9cea-5971-9fdf-b6a4ce9bf35c.jpg,8
Television,Review: 'The Chi' Returns to the South Side of Chicago,https://www.nytimes.com/2019/04/05/arts/television/the-chi-review-season-2.html,"""The Chi"" was built around a series of shootings, and the way their repercussions rippled out through the lives of its large cast. But its best material was casual and observational. The testy relationships of the aspiring chef Brandon (Jason Mitchell) with his live-in girlfriend, Jerrika (Tiffany Boone), and his entrepreneurial frenemy Hannibal (Chris Lee) felt fresh. Even more original and entertaining were the story lines involving the middle schoolers Kevin (Alex Hibbert), Papa (Shamon Brown Jr.) and Maisha (Genesis Denise Hale), whose hilariously passive-aggressive pursuit of the mild-mannered Kevin was the show's single best idea.

That first season can be streamed on Showtime's website or through Amazon Prime Video. It's necessary if you're going to understand what's going on in Season 2, and maybe it's sufficient. Because through five episodes of the new season, a lot of the shine is gone from ""The Chi."" The story lines are largely continuous: the fallout from the killing of Brandon's younger brother by the tortured Ronnie (Ntare Guma Mbaho Mwine); the strife between the player Emmett (Jacob Latimore) and Tiffany (Hannaha Hall), the mother of his child; Brandon's constantly stymied efforts to get his food-truck business off the ground.

But the urgency has faded from them, partly because of a sense that the bones of Season 1 are being gnawed over for too long, but mostly because the show's sensitivity and unpredictability are, at almost every moment, shading over into conventional melodrama and self-conscious point making. As characters make speeches about fatherhood and police corruption, and we sit through stiff, sentimental flashbacks to Ronnie's stressful return from military duty in the Middle East, the show starts to feel like an earlier Showtime drama set in Chicago, the buppie soap opera ""Soul Food.""

The middle schoolers are still used for comic relief -- selling candy bars to parishioners as they break a fast, engaging in a food fight on school picture day -- but the situations have more of a tinny sitcom quality, and the young actors' performances are correspondingly less joyful. (Hale still makes the most of every minute onscreen, though.) Mitchell and Latimore feel stuck, too, with Brandon's and Emmett's stories taking on a flattened, didactic tone they didn't have in Season 1. The major new twist to the plot, a mystery element apparently involving gentrification, is playing out slowly but already feels forced into what's been a distinctively organic narrative.

The cast turnover between seasons was small, though Sonja Sohn, as Brandon's hard-edge mother, and Steven Williams, as an old-school gangbanger, are missed. The one big change was the replacement of the showrunner Elwood Reid by Ayanna Floyd Davis. Their producing and writing credits aren't dissimilar -- ""The Bridge"" and ""Cold Case"" for Reid, ""Empire"" and ""Hannibal"" for Davis -- and it's never a good idea to place too much credit or blame on one person in the ecosystem of a TV series. But chemistry matters, and in Season 2 the formula's off.",Lena Waithe's neighborhood drama on Showtime didn't get the awards-season attention it deserved for Season 1. The window may have closed.,7bb11a9c-2f6d-57f9-bb36-db7f00f59589,https://static01.nyt.com/images/2019/04/05/arts/05thechi-review/05thechi-review-facebookJumbo-v2.jpg?year=2019&h=550&w=1050&s=263c6867c9fa96f766985b4eaa9701908118556e81f328214452b3ec52e61aa9&k=ZQJBKqZ0VN,"Alex Hibbert as Kevin in ""The Chi,"" a sprawling drama that feels stuck in its second season.",7bb11a9c-2f6d-57f9-bb36-db7f00f59589,/Demo_data/D1_imgs_1/7bb11a9c-2f6d-57f9-bb36-db7f00f59589.jpg,3
Opinion,Banks Should Face History and Pay Reparations,https://www.nytimes.com/2020/06/26/opinion/sunday/banks-reparations-racism-inequality.html,"Ms. Blackwell is founder in residence at PolicyLink, a research and advocacy institute, where Mr. McAfee is the chief executive.





Corporate chief executives have been tripping over themselves to demonstrate their support for racial justice. They've taken a knee, tweeted that black lives matter, donated money to advocacy groups and affirmed their commitment to inclusion. That's all well and good. And following through on their promises -- by hiring and promoting more people of color, diversifying boards and executive suites and paying all workers decent wages and essential benefits -- would be even better. But business leaders who are serious about fighting racism will hold themselves accountable for the bitter inequities they have helped to create and sustain, and from which they have profited. Every industry must now use its power to repair the damage and heal the wounds. The financial industry is a good place to start. Banks have been underwriters of American racism -- no industry has played a bigger or more enduring role in black oppression, exploitation and exclusion. Banks financed the slave trade and in some cases ""repossessed"" humans in bondage.

White-owned banks refused to serve black people who left the South escaping brutality and seeking opportunity during the Great Migration of the early and mid-20th century. Bank policies and practices contributed to segregating every major city and denying black families the two most important toeholds to the middle class -- ownership of homes and of businesses. Federal legislation beginning in the 1960s prohibited the most blatant discrimination in banking and lending. It banned redlining, the practice named for the color-coded maps that lenders used to deny mortgages in black neighborhoods. But banks and real estate agents found ways to exploit the desire of black people to own homes, leaving many in foreclosure. Racial disparities in access to the conventional mortgage market endured, leaving black home buyers vulnerable to fraud and risky loans, as the subprime mortgage fiasco exposed so painfully.

Similarly, banks deny loans to black-owned businesses at twice the rate of white-owned ones. This makes it difficult, if not impossible, for small black companies to grow. But the industry doesn't only suppress black wealth, it aggressively strips it, through excessive interest rates on consumer debt, egregious overdraft penalties and higher fees even for simple A.T.M. transactions. It's no surprise that the median black family had roughly one-tenth of the wealth of a white family as of 2016. The gap not only limits education and career options, it's also a source of gnawing anxiety about how the bills will get paid in the event of a job loss or costly illness -- setbacks facing millions of families, again disproportionately black, during the Covid-19 pandemic. Moreover, the wealth gap hurts the nation's economy. McKinsey & Company calculates that closing the black-white wealth gap could increase G.D.P. by 4 percent to 6 percent, or more than $1 trillion, by 2028. A federal reparations policy is unlikely to come anytime soon. But banks and financial institutions don't have to wait. First, they must apologize for their culpability for and complicity in structural racism. Next, they must commit to serving black people as they do whites. Then, with these four bold policies, the industry can start to close the wealth gap, repair the harms and serve as a model for a nation struggling to reckon with racism: Americans carry a lot of consumer debt, but as Christian Weller reports in Forbes, nobody bears a heavier burden than African-American families. They are the only racial group that owes more than their belongings are worth -- they could sell all their possessions and they would still be in debt. More from ""The America We Need"" Black families on average had $8,554 in consumer debt in September 2019. And they pay more for debt -- about $735 a year in interest on every $10,000 they borrow, compared with $514 for white families. Because they have less access to conventional banks and the mortgage market, many black families are forced to rely on high-interest alternatives such as payday loans. Additionally, black people are hit with higher bank fines and harsher punishment, including wage garnishment, for loan defaults, making it harder to climb out of debt. Freeing families from the drag of this debt would help them build savings and obtain financial security. Nearly half of black households have limited access to retail banking services or none at all. And black customers who have bank accounts pay more -- $190 more for a checking account -- compared with white customers, according to one study.

That's because banks in communities of color generally require higher opening balances and minimums to avoid fees, and they charge more for A.T.M. transactions and overdrafts. Seemingly small differences in bank fees pay off handsomely for the industry. Of the more than $11 billion that big banks collected last year in overdraft-related fees, the bulk came from just 9 percent of account holders -- consumers who generally have low bank balances, according to a study by the Center for Responsible Lending. Ending these egregious practices would make banking more attractive to black consumers. The long history of blatant racism in mortgage lending is well known. The Fair Housing Act of 1968 was supposed to end it. But today, the rate of black homeownership, 43 percent, is barely higher than when that law took effect -- and much lower than white homeownership, at 70 percent. Given the persistent racism in the mortgage market and the subprime mortgage disaster, which not only resulted in homeownership disparities but also limited the value of homes owned by black people, banks must provide interest-free mortgages to black home buyers. These loans could be capped at the regional median loan value and should be in place until black homeownership is on par with white homeownership. Expanding secure homeownership for black families and creating opportunities for them to buy in markets where real estate enjoys healthy increases in value will improve economic mobility and begin to create generational wealth. Black Americans, women especially, start small businesses at higher rates than whites. From 2007 to 2012, the number of black-owned businesses increased nearly 35 percent. But almost all are sole proprietorships or partnerships with no employees, in no small part because they lack access to capital. More than half of black-owned companies are turned down for bank loans, twice the rate of white business owners. Black businesses need investment to grow, especially during the pandemic, yet baked-in racism in the Paycheck Protection Program meant that only 12 percent of black and Latino business owners received the loans they requested.",The financial industry can close the wealth gap and serve as a model for a nation struggling to reckon with racism.,165426ae-1e7c-5193-8596-ef96357645a8,https://static01.nyt.com/images/2020/06/25/opinion/25ineqWeb/25ineqWeb-facebookJumbo-v2.jpg?year=2020&h=550&w=1050&s=23b7a6e66e1a2857c85eaee40bf5bf01dfa47a466f49edfac62a5498c3932a79&k=ZQJBKqZ0VN,"A Wells Fargo bank in Minneapolis was set on fire during protests against the death of George Floyd. In 2012, Wells Fargo agreed to pay at least $175 million to settle accusations that it discriminated against black and Hispanic borrowers during the housing boom.",165426ae-1e7c-5193-8596-ef96357645a8,/Demo_data/D1_imgs_1/165426ae-1e7c-5193-8596-ef96357645a8.jpg,11
