section,headline,article_url,article,abstract,article_id,image,caption,image_id,image_path,section_numeric
Technology,"In U.S.-China Tech Feud, Taiwan Feels Heat From Both Sides",https://www.nytimes.com/2020/10/01/technology/taiwan-china-tsmc-huawei.html,"TAINAN, Taiwan -- The United States and China are wrestling to lead the world in artificial intelligence, 5G wireless and other cutting-edge technologies. But the real wizardry that makes those advancements possible is being performed on a yam-shaped island that sits between them, geographically and politically. On Taiwan's southern rim, inside an arena-size facility stretched out among lush greenery and coconut palms, colossal machines are manipulating matter at unimaginably tiny scale. A powerful laser vaporizes droplets of molten tin, causing them to emit ultraviolet light. Mirrors focus the light into a beam, which draws features into a silicon wafer with the precision, as one researcher put it, ""equivalent to shooting an arrow from Earth to hit an apple placed on the moon."" The high-performance computer chips that emerge from this process go into the brains of the latest tech products from both sides of the Pacific. Or at least they did until last month, when the Trump administration effectively forced leading chip makers in Taiwan -- and elsewhere -- to stop taking orders from China's proudest tech champion, the 5G giant Huawei. The administration's stranglehold on Huawei shows that for all of China's economic progress, the United States still has final say over the technologies without which the modern world could not run. Chip making relies on American tools and know-how, which gives officials in Washington the power of life and death over semiconductor buyers and suppliers anywhere on the planet.

Next in the firing line is China's most advanced chip producer, Semiconductor Manufacturing International Corporation. The U.S. Department of Commerce told American companies last week that they needed permission to export to SMIC, saying its chips could be used by China's military. If the administration blocks SMIC from using American software and equipment entirely, it will sharply set back Beijing's hopes for meeting more of its own semiconductor needs. That leaves Taiwanese chip companies -- including the industry's leading light, Taiwan Semiconductor Manufacturing Company, which owns the Tainan plant -- in a tough spot.

They are forced to heed the dictates of American tech policy. Yet they can scarcely ignore the fact that so many of their customers and their customers' customers are in China, where the Communist government is also threatening Taiwan with ever bolder displays of military force. China has for decades claimed the self-governing democracy as part of its territory. In the high-stakes tech fight, TSMC had been playing Finland: a sometime friend to both feuding giants. But that is not the way the tech world works anymore.

""China has virtually no room for maneuver,"" said Pierre Ferragu, the head of technology research at New Street Research. ""The U.S. definitely has the upper hand in the struggle."" Tensions in the Taiwan Strait are rising more broadly this year. The Trump administration has stepped up official exchanges with Taiwan ever since its president, Tsai Ing-wen, won re-election in January over an opponent who was friendlier to Beijing. In response, Chinese aircraft and warships have menaced the island with growing frequency. When a State Department representative, Keith Krach, visited Taiwan recently, Ms. Tsai feted him at a banquet alongside a bevy of government dignitaries and TSMC's retired founder, Morris Chang, a nod to the company's significance to Taiwan's relations with the United States. American officials have taken a great interest in TSMC, whose advanced chips are used in fighter jets and other hardware critical to America's military edge. The company said this year that it would build a new factory in Arizona, responding to American concerns about overreliance on offshore production. Now, the Trump administration's campaign against Huawei has forced TSMC to turn against one of its biggest customers. With the two companies unable to work together without licenses, Huawei may find itself unable to make its late-model handsets, an important chunk of its business, once it uses up its chip inventory. ""I don't think Huawei has much of a future unless they can find some way to get their suppliers to get export licenses,"" said Matt Bryson, an analyst with Wedbush Securities. One of Huawei's deputy chairmen, Guo Ping, said last week that the company was assessing its options.

""Survival is our main goal,"" Mr. Guo said in Shanghai. ""As Alexandre Dumas once said, all of human wisdom is summed up in two words: wait and hope."" TSMC executives sound confident that Huawei's plight will not dent it much. If Huawei cannot order chips from the company, then its rivals will instead. Mark Liu, TSMC's chairman, said at an industry conference last week that Taiwan would continue improving its technology so American and Chinese companies had no choice but to keep working with the island. ""We are enjoying the success of the past,"" Mr. Liu said. But for the future, ""we cannot stay where we used to be before."" TSMC could still get caught in the middle, though, if the U.S. government's continuing attacks prompt Beijing to strike back. A full-blown clampdown on sales to SMIC could increase the risk of Chinese retaliation ""really significantly,"" said Mr. Ferragu of New Street Research. Countermeasures that Beijing might once have considered too self-defeating -- such as choking off Qualcomm's or Apple's sales in China, effectively depriving Chinese citizens of most high-end smartphones -- could start to seem more acceptable.

For Taiwan, these are not just business questions. China's reliance on TSMC's chips has long made people on the island see the company as a bulwark against Chinese military aggression. At its shareholder meeting this summer, an investor, Huang Hsueh-fen, approached the microphone hugging a giant bouquet. ""No matter how serious the pandemic becomes, I must still come offer flowers to the company that is our sacred mountain, protector of the nation,"" Ms. Huang said. Tech workers in Taiwan have a Mandarin rhyme about the young engineers who put in late nights and sacrifice their health for the company: ""A hundred thousand youths, a hundred thousand livers, shift by shift TSMC is saving Taiwan."" So what happens if China stops needing TSMC as much as it does now? This could happen naturally. TSMC is working at the frontiers of physics to continue doubling the number of transistors it can fit onto a piece of silicon. That principle, known as Moore's Law, has guided semiconductor development for decades. Not all tech products today need the most advanced chips, though. Some work best by packaging high-end processors with less sophisticated ones. Simple ""internet of things"" devices do just fine with simpler chips. ""The way we design chips is changing. It just has to,"" said Jay Goldberg, a tech industry consultant and former Qualcomm executive. ""Moore's Law is slowing, and we're just having to design chips in a way to accommodate that.""

China is trying to poach more Taiwanese talent for the task. Dozens of former TSMC managers and engineers joined two ambitious Chinese chip projects last year, according to a person with knowledge of the matter. Ms. Kao of TSMC said recent turnover was less than 5 percent, which the company considered a healthy level. Lin Chih-chieh, a law professor at National Chiao Tung University in Hsinchu, Taiwan, said the island needed stronger laws to keep Taiwanese chip makers' trade secrets from being spirited away to China. Still, Ms. Lin said, Taiwan's chip strengths prevent China from subjugating the island as quickly as it did Hong Kong, where the government has curbed civil liberties.",The island's biggest chip maker has been a coveted partner to both battling giants. But rising nationalism is making it harder to keep the middle ground.,9b15aa80-ee3b-5f5a-9055-a94d36196d85,https://static01.nyt.com/images/2020/09/28/business/00taiwan-chips-1/00taiwan-chips-1-facebookJumbo-v2.jpg?year=2020&h=550&w=1050&s=526b0db5bd418cad33c49e9afc27850636728264763b06f5c62d051d5bb8bf21&k=ZQJBKqZ0VN,"People in Taiwan have a rhyme about TSMC's workers: Shift by shift, they are saving Taiwan.",9b15aa80-ee3b-5f5a-9055-a94d36196d85,/Demo_data/D1_imgs_1/9b15aa80-ee3b-5f5a-9055-a94d36196d85.jpg,20
Movies,"Stuart Gordon, Whose Films Reanimated Horror, Dies at 72",https://www.nytimes.com/2020/03/27/movies/stuart-gordon-dies.html,"Stuart Gordon, a director best known for lavishly lurid horror films with a piercing sense of humor, notably the cult favorite ""Re-Animator,"" died on Tuesday in Van Nuys, Calif. He was 72. His wife, Carolyn Purdy-Gordon, an actress who appeared in many of his films and with whom he founded the Chicago-based Organic Theater Company, said the cause was multiple organ failure brought on by kidney disease. Mr. Gordon's generally low-budget films often combined the body horror of John Carpenter or David Cronenberg's films with the titillation found in Roger Corman's. He said that surprising moviegoers was an important part of his work, and he did his best to exceed the everyday terrors of many slasher movies. ""There is a side of me that likes to break through cliches and wake people up,"" Mr. Gordon told Rolling Stone in 1986.

Before turning to film, he directed experimental plays at the Organic Theater Company in the late 1960s. The company produced original works, like the comic-book-themed trilogy ""Warp,"" one-third of which briefly made it to Broadway in 1973; it also staged the first production of David Mamet's breakout play, ""Sexual Perversity in Chicago,"" in 1974. ""Re-Animator"" (1985), Mr. Gordon's first feature film, was based on a serialized story about human revivification by H.P. Lovecraft. He wrote the adaptation with Dennis Paoli and William Norris. The movie centers on Herbert West, a medical student played by Jeffrey Combs (he would become a stock player of sorts for Mr. Gordon) who discovers a chemical reagent that returns dead bodies to life. His experiments with it yield ever more grotesque results, culminating in a gang of marauding undead. One unforgettable scene involves the severed head of a reanimated corpse and a captive young woman.

""'Re-Animator' has as much originality as it has gore, and that's really saying something,"" Janet Maslin wrote in her review in The New York Times when the movie opened in New York theaters. The film, she added, ""has a fast pace and a good deal of grisly vitality"" and even ""a sense of humor, albeit one that would be lost on 99.9 percent of any ordinary moviegoing crowd.""

Mr. Paoli, who also worked with Mr. Gordon on later Lovecraft adaptations, said in a telephone interview that the humor-horror hybrid in ""Re-Animator"" and other Gordon films was similar to that in his theater work, which often straddled the line between the serious and the hilarious. ""If you watch someone laughing and you don't hear them, it looks like they're screaming,"" Mr. Paoli said. ""The fact is they're both releases of tension, and Stuart was a genius at storing up that tension and then releasing it over the line in one direction or another."" That same combination of mordant comedy, graphic violence and cosmic horror turned up in Lovecraft derivations like ""From Beyond"" (1986), about a doctor who uses a device to see into alien dimensions and whose pineal gland bursts through his forehead; and ""Dagon"" (2001), about a village of human-fish hybrids who enjoy procreating with people and sometimes skinning them. Not all Mr. Gordon's films were creature features. He, Brian Yuzna and Ed Naha came up with the story for the hit Disney film ""Honey, I Shrunk the Kids"" (1989), and he was an executive producer of the sequel, ""Honey, I Blew Up the Kid"" (1992).

He also made science fiction films, like ""Fortress"" (1992), about a high-tech prison in a dystopian future; and nightmarish dramas, like ""Stuck"" (2007), about a woman who crashes into a homeless man with her car while intoxicated, then drives home with him trapped in her windshield and barely alive. Mr. Gordon adapted the work of other authors, like Edgar Allan Poe (""The Pit and the Pendulum,"" 1991) and Ray Bradbury (""The Wonderful Ice Cream Suit,"" 1998). He returned to the work of Mr. Mamet with the film version of his one-act play ""Edmond"" (2005), about a man, played by William H. Macy, who renounces his strait-laced life and goes on a wild tear that ends with murder and a long prison sentence. To Mr. Gordon, the goal of supposedly highbrow theater was not much different from that of a blood-soaked horror film. ""I have never separated art from having a good time,"" he said in 1986. Stuart Alan Gordon was born in Chicago on Aug. 11, 1947, to Bernard and Rosalie (Sabath) Gordon. His father was a supervisor at a cosmetics factory, his mother a high school English teacher. He graduated from high school in Chicago before studying theater at the University of Wisconsin, Madison. At the university Mr. Gordon formed Screw Theater, an experimental troupe that incensed the college authorities with a 1968 production of ""Peter Pan"" that featured a nude dance sequence. Mr. Gordon and Ms. Purdy, who was in the show, were arrested after the second performance, and the university demanded that Mr. Gordon submit future scripts in advance and allow faculty members into every rehearsal. Mr. Gordon declined and left the university.","His low-budget movies, notably the cult favorite ""Re-Animator,"" combined grisly body horror with a mordant sense of humor.",e2049485-82ff-5197-bc70-4be4f63d1be2,https://static01.nyt.com/images/2020/03/29/obituaries/29gordon-obit1/24gordon-facebookJumbo.jpg?year=2020&h=550&w=1050&s=c9e89045491df6b2332318b7530b799797b6d250ac7d3de195d57db9ae16028c&k=ZQJBKqZ0VN,"The director Stuart Gordon in 2008. Celebrated for his lavishly lurid horror movies, he was also known for theater work that, like his films, often straddled the line between the serious and the hilarious.",e2049485-82ff-5197-bc70-4be4f63d1be2,/Demo_data/D1_imgs_1/e2049485-82ff-5197-bc70-4be4f63d1be2.jpg,5
Travel,TripAdvisor to Stop Selling Tickets to Many Animal Attractions,https://www.nytimes.com/2016/10/11/travel/tripadvisor-to-stop-selling-tickets-to-many-animal-attractions.html,"TripAdvisor, one of the world's largest travel websites, and its booking service, Viator, will no longer sell tickets to hundreds of attractions where travelers come into contact with wild animals or endangered species held in captivity, the company announced Tuesday. The attractions include elephant rides, swimming-with-dolphin experiences and the petting of endangered species like tigers. The decision, the first of its kind by a leading travel booking site, came after roughly six months of research and consultation with animal groups like People for the Ethical Treatment of Animals (PETA), Association of Zoos and Aquariums (A.Z.A.), Global Wildlife Conservation (G.W.C.) and others. ""TripAdvisor is a leader in the industry and we understand and applaud that this is a precedent-setting move,"" a corporate liaison for PETA, Stephanie Shaw, said. PETA and other animal welfare groups say dolphins and elephants held in captivity for entertainment purposes can suffer severe physical and psychological damage.

TripAdvisor also announced the creation of a wildlife tourism education portal, in partnership with leading animal protection organizations, that will inform the site's users who review attractions and general visitors about animal welfare issues. ""We believe the end result of our efforts will be enabling travelers to make more thoughtful choices about whether to visit an animal attraction and to write more meaningful reviews about those attractions,"" TripAdvisor's chief executive and co-founder, Stephen Kaufer, said in a statement. All animal attractions, even those that will no longer be bookable, will remain on the site in the review section, as long as they follow standard listing procedures, but will be marked with a ""PAW"" icon that will link to the education portal with ""numerous points of view"" relevant to the animals involved from a variety of organizations, TripAdvisor said. TripAdvisor will stop selling tickets to some attractions immediately, but the totality of the booking policy changes, as well as the educational portal, will not be completely implemented until early 2017. There will also be an appeals process for the hundreds of affected attractions should they be able to prove they are within the new policy, the company said. Last October, Oxford University's Wildlife Conservation Research Unit, which will be working with TripAdvisor on its education initiative, released a comprehensive study on wildlife tourism. Among its many findings was that between two million and four million tourists per year pay to visit attractions that are considered harmful to animal welfare, and that a large majority of TripAdvisor reviews for such attractions failed to mention animal welfare concerns.

""I think the average person would think that there's animals there, there's gotta be laws and regulations behind what's happening, but that's not the case, even in places like the U.S.,"" Wes Sechrest, the chief scientist and chief executive of the conservation group G.W.C., said. The entire initiative began several months ago after animal groups and users in the TripAdvisor community expressed concerns, the company said. In April, the World Animal Protection (W.A.P.) agency singled out TripAdvisor in its ""Wildlife, not entertainers"" campaign, asking for signatures on a petition calling for the types of changes that the company is now promising to implement. W.A.P. will now be partnering with TripAdvisor on its educational initiative. While most of the animal groups involved in this effort echoed PETA's overall approval of the new policies, not all groups had every concern addressed. ""There are some areas that I think every one of these groups we spoke with would agree on, and there are some that are not universally agreed upon,"" TripAdvisor's chief marketing officer, Barbara Messing, said. ""We just had to, at the end of the day, come to our own conclusions internally about what makes sense for us and what we thought reflected the totality of what we learned from the groups."" PETA opposes all activities where animals are kept in captivity for profit, including those at zoos and aquariums, but these attractions will remain bookable. However, add-on attractions that are not in compliance with the new policy will not, TripAdvisor said. TripAdvisor's new policy also includes many exemptions, like feeding programs where visitors are under the supervision of zoo or wildlife officials, such as giraffe feeding at the San Diego Zoo, children's petting zoos with domestic animals and voluntourism programs like the ones at the Elephant Nature Park in Thailand, where contact with elephants is likely for visiting volunteers.

Animal welfare groups are hoping these changes create a ripple effect throughout the travel booking industry. ""TripAdvisor's competitors and others within the travel industry will take note of this, and we hope and expect that many other companies will follow,"" Ms. Shaw of PETA said. TripAdvisor, and its competitors like Expedia, already do not allow bookings that involve killing or injuring captive animals for blood sport, but TripAdvisor is the first travel booking site of its size and influence -- the company reaches 350 million unique visitors per month -- to limit access to attractions featuring more commonly practiced tourist-animal engagement. ""We do think it's an important issue, and we want to be part of the solution,"" Sarah Gavin, vice president of global communications at Expedia, said of animal welfare and the travel booking industry. ""But we need help from the animal welfare community to make it a reality.""","TripAdvisor will no longer sell tickets to attractions like elephant rides and dolphin swims, a decision that could reshape how booking sites approach animal welfare.",c6571c5f-d895-560e-bd3f-d5dba0dc0e30,https://static01.nyt.com/images/2016/10/11/travel/11tripadvisor-animals/11tripadvisor-animals-facebookJumbo.jpg?year=2016&h=550&w=1050&s=888302f5eebb20125c4a8389197437dc7a0e1dc689e3a8b2a8add2639e4a28d1&k=ZQJBKqZ0VN,Tourists riding elephants in the Chiang Mai province of Thailand.,c6571c5f-d895-560e-bd3f-d5dba0dc0e30,/Demo_data/D1_imgs_1/c6571c5f-d895-560e-bd3f-d5dba0dc0e30.jpg,4
Movies,'On the Rocks' Review: Daddy Dearest and His Late Bloomer,https://www.nytimes.com/2020/10/01/movies/on-the-rocks-review.html,"It isn't surprising how effortlessly Bill Murray takes possession of Sofia Coppola's gently comic ""On the Rocks"" -- though this hijacking may be more of a sly directorial surrender. Casting Murray is a surefire way to win over an audience. It also means yielding at least part of the movie to him, which is what happens here. He plays a bigger-than-life sybarite whose daughter enlists him to help with her marital woes. If that sounds like a dubious idea for a grown child, it's also a playful conceptual gambit for a director whose father, Francis Ford Coppola, casts his own long shadow.

Murray plays Felix, a retired gallerist and full-time bon vivant who's done ostentatiously well for himself, with a vintage Alfa Romeo in the garage and an Ellsworth Kelly on the mantel. His daughter Laura (Rashida Jones, yet another child of a legendary father) is a writer who's struggling to put words on paper while caring for her two young girls. Her husband, Dean (Marlon Wayans), always seems to be perfunctorily kissing Laura hello or goodbye on his way out the door (to run his generic start-up), leaving her in the soft domestic chaos that envelops her. She may be the heroine of this story, but she isn't the center of her universe.

The plot hinges on Laura's not-unreasonable fear that Dean is no longer interested in her and may be having an affair. All the familiar signs seem to be there, including his business trips and long work hours that often find Laura home with the children. Coppola sketches in Laura's world and its loneliness (ripe terrain for dark thoughts) early and starkly when Dean abruptly pulls away from her embrace one night. The next morning, as Laura tends to the kids, and Dean hurries to leave for work, they move around their kitchen with well-rehearsed choreography. The domestic cacophony may be reassuring, but the coarsening of intimacy is palpable.

Coppola's minimalism can be frustratingly rather than productively diffuse, but her aesthetic reserve suits this story and the diffidence of her heroine. Laura is appealing -- or rather Jones is -- and you're drawn to her just by virtue of her being the lead. Even so it's instructive that the first voice you hear in the movie is Felix's. ""And remember, don't give your heart to any boys,"" he says in voice-over, right after the American Zoetrope credit appears and before the first image materializes. ""You're mine until you get married,"" Felix continues, ""then you're still mine."" A girlish voice laughs and adds an incredulous ""OK, Dad."" And then Chet Baker starts singing.","In Sofia Coppola's latest, Rashida Jones plays a woman worried about her marriage. Who's she gonna call? Bill Murray, a.k.a. Dad.",5f5fe44c-ed73-534c-9606-d1007e8d65a5,https://static01.nyt.com/images/2020/10/02/arts/00ontherocks/00ontherocks-facebookJumbo-v2.jpg?year=2020&h=549&w=1050&s=e56dd84aa16c0a2f0cc042532f8808d60f41d261ad0b44c5fcffc56a93a543c2&k=ZQJBKqZ0VN,"""You're mine until you get married — then you're still mine."" Rashida Jones and Bill Murray play a daughter and father in Sofia Coppola's ""On the Rocks.""",5f5fe44c-ed73-534c-9606-d1007e8d65a5,/Demo_data/D1_imgs_1/5f5fe44c-ed73-534c-9606-d1007e8d65a5.jpg,5
Television,"What's on TV Saturday: 'Bloody Nose, Empty Pockets' and 'Unidentified'",https://www.nytimes.com/2020/07/11/arts/television/whats-on-tv-saturday-bloody-nose-empty-pockets-and-unidentified.html,"WE ARE LITTLE ZOMBIES (2020) Watch through virtual cinemas. This movie, a New York Times Critic's Pick, follows four recently orphaned teenagers, who, bonded by their inability to cry, decide to form a rock band and work through their bereavement together. Written and directed by Makoto Nagahisa and shot by the cinematographer Hiroaki Takeda, the film mimics ""the aesthetics and structure of video games, with multiple levels and more than one choice of ending,"" Jeannette Catsoulis wrote in her review for The Times. She added that the film is ""smart, noisy and flashily assured,"" and ""entirely, gleefully its own thing.""

THE TWELVE Stream on Netflix. This Belgian series is a crime and legal drama that delves into the country's jury system. After a young woman named Frie Palmers (Maaike Cafmeyer) is accused of murdering her best friend and her own daughter, 12 jurors are selected to hear the case. As the trial plays out -- and sordid details of Palmers's life are aired for a national audience -- members of the jury are forced to face their own personal indiscretions and question the limits of the legal system.","Watch an experimental film about bar regulars, and Tom DeLonge's U.F.O. series returns.",7d93428e-d390-5cb2-a4a8-cb3c5a93a1c2,https://static01.nyt.com/images/2020/07/12/arts/11tvcol-pockets/12tvcol-pockets-facebookJumbo.jpg?year=2020&h=550&w=1050&s=01e9f0a62e6186450a988af5b8fc9f6dc7e7c52f8fe8a2e25b8d1d65d62eac1a&k=ZQJBKqZ0VN,"A still from ""Bloody Nose, Empty Pockets.""",7d93428e-d390-5cb2-a4a8-cb3c5a93a1c2,/Demo_data/D1_imgs_1/7d93428e-d390-5cb2-a4a8-cb3c5a93a1c2.jpg,3
